titre_article,category,titres_sections,texte
Aménagement extérieur : choisir sa clôture rigide en panneaux de grillage acier,Conseils & Astuces,Comment installer sa clôture en panneaux acier de grillage rigide ? | Comment entretenir sa clôture en panneaux acier de grillage rigide ? | Quels sont les autres avantages de la clôture en panneaux acier de grillage rigide ?,"Si les aménagements « à l’américaine » (sans clôture) séduisent certains d’entre nous, il faut admettre qu’en l’absence de limites visibles aux abords de votre habitation, l’inconfort se fait vite ressentir. En effet, comment s’assurer de la   de vos enfants sans garder un œil sur eux en permanence ? De même, comment rester en bons termes avec votre voisinage si votre chien se promène et laisse ses marques sur leur propriété (et vice-versa)? Enfin, comment profiter sereinement de ses extérieurs lorsque tout individu peut s’y inviter ? Vous l’avez compris,  . Eviter l’œil d’un voisin trop curieux, l’attention indiscrète d’un passant promenant son chien dans la rue ou même les mauvaises intentions d’une personne malveillante, est une priorité. A cet effet, l’  autour de votre propriété vous permettra de vous sentir plus serein. Différents systèmes et matériaux s’offrent à vous. Nous vous invitons dans cet article à découvrir le plus utilisé actuellement :  .   A pied ou en voiture, où que votre regard se pose, vous observez l’ . Son succès s’explique par sa   et son effet immédiat. Composée d’acier,   et protègera votre propriété pendant de nombreuses années. Comme mentionné précédemment, l’un de ses atouts réside dans sa facilité d’installation. Alors suivez nos conseils pour   vous aussi votre espace de vie extérieure. Avant d’entamer tous travaux sur votre propriété, renseignez-vous auprès de votre mairie concernant le  de votre localité. De la même manière, vous devrez vous référer au  . Tout bricoleur, même débutant, peut se charger de   lui-même. Il aura besoin de peu de matériel et celui-ci est très accessible à tout novice en la matière : Afin d’ , il vous faut suivre  quelques règles. Tout d’abord vous devez déterminer la hauteur de votre clôture et donc du panneau en acier de votre future clôture rigide. Le premier réflexe, pour des raisons budgétaires principalement, serait de se munir de très longs panneaux de 3 mètres afin de limiter la quantité de   et donc le  . Du point de vue technique, nous vous enjoignons à opter pour des panneaux mesurant entre 2 m et 2,50 m maximum. En effet, c’est une loi physique : plus la surface de vos panneaux de grillage rigide sera élevée, plus ils se tordront facilement. Ils perdront ainsi une part de leur qualité de robustesse et l’esthétique ne sera plus au rendez-vous non plus. Voici une   qui s’applique aux projets dans des zones ventées ou de grande envergure : les  . Ceux-ci permettent de répartir les forces sur les zones de pression, ainsi   augmente. D’autres critères sont à étudier comme les dimensions des mailles ou le diamètre des  s. Par exemple, plus les fils sont épais, plus votre clôture est solide face aux tentatives d’intrusion par découpage. D’ailleurs, nous vous recommandons d’  dont les fils mesurent 4mm au minimum. De même, la petite taille des mailles implique une plus grande quantité de fils et donc une   accrue de la matière. Selon votre projet et le  , vous privilégierez des formes de poteaux différentes : ronds, carrés etc. Le critère le plus important, toujours dans une optique de  , est la dimension de sa section. La formule est simple : plus elle est grande, plus elle sera résistante. Du côté des  , le   du point de vue de la  , de la   et du  , restent les poteaux à encoches. Vous trouverez également les fixations à clips ou attaches en plastique du type PVC. Dans tous les cas de figure, lors de votre choix, veillez à ce que vos   dépassent de 30 à 50 cm votre  . L’assemblage est une simple suite logique : 1)    Scellez le 1er poteau dans le  , 2)    Accrochez le panneau en grillage rigide sur le 1er poteau, 3)    Accrochez le 2ème poteau au grillage 4)    Scellez le 2ème poteau grâce au béton rapide 5)    Et continuez votre   selon la même procédure Une fois le béton séché au pied de vos poteaux, vous retirerez les   ayant servi à caler le tout. C’est terminé ! Enfin, le   : les prix avoisinent la trentaine d’euros au mètre linéaire pour l’ensemble poteau/panneau (hauteur 1,50 m)/accessoires.   Les   des occultants en plastique souples ou rigides oscillent quant à eux entre une quinzaine et une quarantaine d’euros le mètre. Vous connaissiez la clôture en rouleaux de grillage souple, celle qui se détend au fil des ans. Celle encore sur laquelle il faut jouer régulièrement des tendeurs pour en conserver l’aspect net et dissuasif. Avec votre   vous gagnerez du temps et de l’énergie sur ces opérations de maintenance…tout simplement car elle ne demandera plus aucun entretien.   De plus, ce type de clôture vous permet de laisser libre cours à votre créativité. Selon votre souhait,  . Elle est aussi un   comme les chèvrefeuilles, lierres, jasmins, rosiers grimpants ou lianes, clématites… Et pour contenir votre haie, c’est le matériau parfait car l’acier ne se déformera pas. Néanmoins tout système a ses limites, aussi vous réserverez votre vigoureuse glycine pour un autre support, plus adapté. Vous préférez les   aux plantes grimpantes ? Votre  le permet également. Osier, brande de bruyère, lames PVC ou bois, le choix est large et vous permet de personnaliser votre clôture au gré de vos envies. Si vous résidez dans une région très venteuse, gardez à l’esprit que les brise-vues donnent plus de prise au vent, vous devrez donc adapter votre occultation en fonction de ce paramètre. On associe souvent l’« acier » à la résistance et à la longévité mais aussi à la  . Il s’agit d’ailleurs de la principale crainte dès que l´on parle de ce métal. A ce propos, soyez rassuré, les   sont en général fabriquées à partir de  . Ce procédé alliant   permet d’obtenir un métal robuste et non soumis à la corrosion. Afin d’être efficace, la   doit être a minima de 80g/m². Dans un deuxième temps, ces fils métalliques sont soudés entre eux pour former le panneau, lequel sera ensuite peint selon différentes méthodes. Sur ce dernier point en particulier, soyez vigilant car selon celle utilisée, la clôture sera garantie plus ou moins longtemps. Nous vous recommandons de bien lire les étiquettes et de repérer la mention  . Celle-ci est gage d’une  , a contrario de la « phosphatation amorphe », par exemple. Un indice de la fiabilité d’un produit auquel vous pouvez faire confiance : les fabricants dont la qualité des produits est professionnelle les garantissent  .  Votre tranquillité est ainsi assurée pour longtemps !       Simplicité d’installation, gain de temps, économies, personnalisation… La   multiplie les avantages, tout en assurant sa fonction première :  . Cet article a été réalisé en collaboration avec MOREDA RIVIERE TREFILERIAS"
Guide de rénovation pour parquet ancien,Conseils & Astuces,Evaluation de l'état du parquet | Techniques de restauration | Traitement du parquet,"Tout résistant soit-il, avec le temps un   peut s’abîmer. Il devient terne, perd de son éclat ou encore perd de la matière sur les lames. Lorsque   ancien est trop abîmé et que des produits d’entretien ne suffisent plus à lui rendre son éclat, il peut être nécessaire de procéder à sa rénovation. Dans ce  , L’Entrepôt du Bricolage vous apporte des conseils précieux pour lui redonner vie. La   peut apporter une nouvelle identité à votre intérieur tout en préservant le charme et l’authenticité du bois. Avant de commencer les travaux, il est essentiel   Suivez ces étapes pour assurer une rénovation réussie. Plusieurs traitements de rénovation sont possibles pour les parquets. Toutefois, afin de choisir les produits adaptés et les actions spécifiques, il est essentiel de procéder à une inspection minutieuse de l’état du parquet. Commencez par une . Repérez les zones endommagées, les éventuelles tâches, les fissures et les parties décollées. Un   avec notamment des  . Découvrez également les zones où le bois a perdu de sa couleur d’origine.  Utilisez un   pour évaluer le taux d’humidité du parquet. Un taux élevé peut causer des problèmes à long terme, comme le gonflement du bois. Assurez-vous que le parquet est sec avant de commencer la rénovation. En effet   vous permettra d’évaluer la bonne santé de votre parquet. Dans une atmosphère où l’humidité est très importante, votre parquet ancien peut d’une part, changer de teinte, présenter des traces de moisissures ou encore se décoller notamment au niveau des zones de jointure entre les murs et le parquet. Si vous constatez des problèmes d’humidité au niveau des plinthes ou sur certaines lames, vous devrez procéder à leur remplacement. La  est l’un des points essentiels à prendre en considération lors d’un choix de parquet. En effet, les essences de parquet ancien peuvent être différentes selon leur besoin de résistance ou non. Ainsi, en fonction de la zone de trafic, c’est-à-dire de la  , le parquet va monter une usure plus ou moins prononcée. Identifiez les zones du parquet qui subissent le plus de trafic. Ces zones peuvent nécessiter une  . Il est possible que des zones spécifiques nécessitent une réparation plus intensive. Lors de votre inspection visuelle de l’état du parquet ancien, vous devrez notamment vous attarder sur l’épaisseur du bois. En effet, certains travaux de rénovation pour parquet ancien se font après avoir procédé au ponçage de celui-ci.  Toutefois,  Maintenant que vous avez évalué l’état du parquet, il est grand tant de vous lancer dans sa restauration. L’Entrepôt du Bricolage vous brief sur les  pour redonner toute sa splendeur à votre parquet ancien. L’examen visuel de votre parquet ancien vous aura permis de repérer les zones endommagées. Plusieurs produits présentés par l’entrepôt du bricolage peuvent vous aider à réparer les zones endommagées de votre parquet ancien. Utilisez un  . Assurez-vous que le mastic correspond à la teinte du bois pour un résultat harmonieux. Appliquez le mastic à bois à l’aide d’une spatule pour pouvoir l’étaler le plus uniformément possible pour que la couche soit la plus fine possible. Une fois le mastic ou la pâte à bois bien sec, vous pouvez procéder à un léger ponçage pour enlever tout le surplus. Pour les petits trous ou les rayures ou éraflures peu importantes, soit moins de 3 mm, vous pouvez  Votre parquet a perdu de son éclat ? Il est terne, usé et semble vraiment moche par endroit ? Vous n’aurez peut-être pas d’autre choix que de le poncer.  Utilisez une   pour les grandes surfaces et une  ou  pour les zones plus délicates. Attention également au moment du ponçage, veillez à ne pas appuyer trop fort, ce qui aurait pour conséquences de creuser votre parquet. Si vous devez traiter une grande surface, préférer les ponceuses à parquet (location disponible dans nos magasins). N’oubliez pas de porter un masque de protection et des lunettes pour éviter l’inhalation de poussière. Une fois le ponçage terminé, vous pouvez choisir la finition pour protéger le parquet. La majeure partie du temps les travaux de  portent sur une   mais on peut aussi se tourner ver  la cire. Chaque finition à ses avantages, alors choisissez celle qui convient le mieux à vos besoins en termes d’entretien et d’esthétique. Le traitement du parquet est sans nul doute une étape cruciale dans la   C’est la touche finale, celle qui lui redonnera tout son panache et son éclat. Le traitement du parquet est donc fondamental. Si le parquet a perdu de sa couleur d’origine, vous pouvez le teinter pour restaurer son éclat.   Effectuez des tests sur une petite zone pour vous assurer que la teinte correspond à vos attentes. Notre gamme de teinture bois Libéron vous permettra de choisir plusieurs teintes : Une fois la teinture appliquée,   pour protéger le parquet. Suivez les instructions du fabricant pour un résultat optimal. Après la restauration, entretenez régulièrement le parquet en le   et en provoquant des contacts excessifs avec l’eau. La rénovation d’un parquet ancien demande du temps et des efforts, mais le résultat final en vaut la peine. En suivant ces étapes d’évaluation et de restauration, vous pourrez redonner vie à votre parquet tout en préservant son caractère unique. À L’Entrepôt du Bricolage, vous trouverez tous les outils et matériaux nécessaires pour mener à bien ce projet passionnant. Transformez votre espace avec élégance en ramenant à la vie le charme intemporel d’un parquet ancien."
Comment poser des pavés sur le sable ? Guide complet,Tutos,Comment préparer son chantier ? | Comment préparer son support ? | Comment poser la bordure ? | Comment créer un lit de sable ? | Comment poser les pavés ? | Comment réaliser le jointoiement ? | Comment appliquer un traitement de protection ? | Le pavage : résumé,
Comment mesurer un entraxe de poignée de porte ?,Tutos,Les différents types d'entraxes | Pourquoi mesurer l'entraxe est-il si important ? | Les outils nécessaires pour mesurer l'entraxe | Comment mesurer l'entraxe ? | Que faire si mon entraxe de fixation n'est pas dans les standards ?,"Vous souhaitez redonner un coup de jeune à vos portes en changeant  ? C’est une excellente idée pour personnaliser votre intérieur et améliorer votre confort au quotidien. Avant de vous lancer dans cette rénovation, il est essentiel de bien comprendre   et pourquoi il est essentiel de le mesurer avec précision. , c’est tout simplement   précis sur votre porte. Cette mesure, souvent méconnue, est  qui s’adaptera parfaitement à votre installation. Un mauvais choix d’entraxe peut entraîner des difficultés d’installation, un fonctionnement défectueux de la serrure, voire des dommages à votre porte. Dans cet article, nous allons vous guider pas à pas pour mesurer l’entraxe de votre poignée de porte. Nous aborderons les différents types d’entraxes, les outils nécessaires, les étapes de mesure et les solutions en cas d’entraxe atypique. Ce qu’il faut retenir de cet article Il existe deux principaux types d’entraxes à prendre en compte lors du choix d’  :            avec précision est primordial pour plusieurs raisons : Pour mesurer l’entraxe de votre poignée de porte, vous aurez besoin des outils suivants :     Les entraxes les plus courants pour les poignées de porte sont :   Cependant, il est important de noter que ces dimensions peuvent varier en fonction des fabricants et des modèles de poignées. C’est pourquoi il est essentiel de   avant d’effectuer votre achat.     Vous ne savez plus si votre entraxe de fixation est de 165 ou de 195 mm ? Cela n’est plus un problème avec  DUALFIT ! Cette poignée de porte propose un concept novateur pour s’adapter à ces 2 entraxes standards ! Si l’entraxe de fixation de votre porte ne correspond pas aux dimensions standard, plusieurs solutions s’offrent à vous :   Pour terminer,  . Ce petit élément en forme de carré inséré dans la serrure permet de relier la poignée au mécanisme de verrouillage. Il existe différents types de carrés, il est donc essentiel de   du vôtre lors de l’achat d’une nouvelle poignée. Un carré de mauvaise taille ne permettra pas d’installer correctement la poignée (la longueur) et pourrait endommager la serrure (la largeur).     En suivant ces conseils, vous serez en mesure de mesurer  utiles pour pour choisir la poignée de porte parfaitement adaptée à votre installation et de profiter d’un confort d’utilisation optimal"
Comment choisir sa piscine hors-sol ? Notre guide d’achat complet !,Conseils & Astuces,Quelles sont les différentes piscines hors-sol ? | Quel est le prix d'une piscine hors-sol ? | Quelle est la meilleure piscine hors-sol ? Les critères à prendre en compte | Choisir le matériau de votre piscine : quelles sont les piscines hors-sol les plus solides ? | Où placer une piscine hors-sol ? | Entretien de la piscine hors-sol : comment garder une piscine propre ? | Piscine hors-sol : quelles sont les obligations légales ? | En résumé,"Cet été, profitez-en pour vous rafraîchir grâce à notre gamme de piscines hors-sol pour tous les budgets !"
Comment préparer son jardin pour le printemps ?,Conseils & Astuces,Préparation du sol : la clé d'un jardin prospère | Préparation du potager : cultivez vos propres légumes | Entretien du jardin : soins et maintien | Maximiser l'utilisation des espaces | Adopter des pratiques respectueuses de l'environnement ,"Le   commence à pointer le bout de son nez et si vous êtes amateur de jardinage, vous êtes probablement en train de penser à la préparation de votre jardin en vue des beaux jours. Après les longs mois d’automne et d’hiver où la terre a eu le temps de se reposer, c’est le moment idéal pour préparer votre jardin à accueillir de nouvelles plantations et à reprendre vie. Nous vous livrons ici nos   pour préparer votre   pour le printemps en utilisant les  . Avant de réaliser des plantations, il est essentiel de bien préparer sa terre en  . L’amendement consiste à enrichir son sol grâce à divers composants tels que de l’engrais, du   ou encore du compost. Cela permet à votre terre d’avoir une meilleure absorption de l’eau mais également d’être enrichie. L’amendement de votre sol dépend du type de terre dont vous disposez. Afin de procéder à cette étape, il est conseillé de commencer par retourner la terre à 45cm de profondeur avec des outils tels qu’une  , un  ou encore une  . Puis, étalez les amendements de votre choix en formant une couche d’une dizaine de centimètres. Enfin, nivelez votre terrain à l’aide d’un   et laisser la terre se reposer.   Le printemps, c’est la saison de la vie et quoi de mieux que de donner naissance à vos propres légumes ? Voici quelques conseils utiles pour la  Décidez quelles variétés de légumes vous souhaitez cultiver et élaborez un   en fonction de leurs besoins en espace, en lumière et en eau. Commencez à semer vos graines à l’intérieur dans des  , en suivant les recommandations de chaque variété concernant la profondeur de semis et la période de germination. Pour les légumes qui préfèrent être plantés directement en pleine terre,   en amendant le sol et en le nivelant soigneusement avant de planter. Afin d’anticiper la croissance de vos plants, n’oubliez pas de vous procurer des  . Et si vous rencontrez des problèmes avec votre terre, n’hésitez pas à planter vos fruits et légumes dans des   prévus à cet effet. Concernant la plantation de fleurs, plantes et petits arbres tels qu’un citronnier, des  et  vous seront très utiles et vous permettront de mettre facilement vos plantes à l’abri durant l’hiver. Trouvez votre bonheur parmi notre large sélection des pots et carrés potagers. La clé d’un jardin et d’un potager durables, c’est bien sûr l’entretien. De   au  , en passant par  , nous vous guidons sur les   pour prendre soin de vos plantes. Pendant les mois plus chauds du printemps et de l’été, assurez-vous de fournir à vos plantes suffisamment d’eau pour les aider à s’établir et à prospérer. Lorsqu’il fait particulièrement chaud, il est conseillé d’arroser son potager et ses plantes à la tombée de la nuit lorsque la température redescend. Quant aux équipements nécessaires, il est aujourd’hui vivement recommandé d’utiliser un  , dont   vous permettront, entre autres, de réaliser de vraies économies d’eau. Profitez du début du printemps pour tailler les arbustes, les arbres et diverses plantes afin de favoriser une croissance saine et une floraison abondante. Pour tailler votre haie, nous vous invitons à vous munir d’un  . Un  est très utile pour tailler vos rosiers ainsi que des branches fines de vos arbres fruitiers et autres plantes. Pour des branches plus imposantes, aidez-vous d’un  . N’oubliez pas de porter des   pour protéger vos mains et afin de pouvoir rassembler vos déchets verts, un   pourra vous être utile. Enfin, si vous souhaitez conserver votre bois pour l’hiver ou en vue des barbecues, une   pourra vous être utile. Entretenez votre jardin avec des outils de qualité grâce à notre vaste sélection de produits. Éliminer régulièrement les mauvaises herbes, c’est la garantie de plantations qui respirent. Le désherbage est également indispensable lorsque vous souhaitez maintenir l’aspect soigné de votre jardin. À l’intérieur de votre potager, effectuez le désherbage à la main, à l’aide d’un  ou bien avec un  . Pour les mauvaises herbes tenaces sur votre pelouse, vos zones pavées ou encore vos parterres de fleurs, un   ou   vous facilitera grandement la tâche. Peu importe la taille de votre extérieur, le printemps est le moment propice pour l’aménager ou le réaménager. Optimisez l’utilisation de votre espace en y incorporant du rangement grâce à un  , par exemple. Si vous souhaitez meubler votre terrasse ou votre jardin, veillez à choisir des   adaptés à votre espace. Aménagez votre extérieur comme un pro avec notre mobilier de jardin ! L’arrivée du printemps est idéale pour entamer des projets d’amélioration de votre espace extérieur. Si vous souhaitez créer une terrasse ou que vous avez une dalle existante,   Nombreuses sont les options pour le faire :  ,   ou encore  , les possibilités sont infinies ! Des dalles en pierre rustique aux designs élégants et modernes, nous avons tout ce dont vous avez besoin pour transformer votre terrasse et votre extérieur. Venez donc jeter un coup d’œil à notre dernière sélection ! Lors de l’aménagement de votre terrain, pensez également à incorporez des éléments qui vous fourniront de l’ombre. Que ce soient des arbres, des  , des  ou encore  investissez dans de la qualité. Si vous avez du vis-à-vis, les   ou encore les haies végétales deviendront rapidement vos meilleurs amis. Favorisez la santé du sol et la biodiversité en utilisant des pratiques de jardinage biologique, telles que la  , le   et la  . Cette année, il est grand temps d’investir dans un   ! Il vous permettra, entre autres, de réutiliser vos déchets verts, tels que les feuilles mortes et les débris végétaux. En les mélangeant aux déchets du quotidien obligatoirement compostables, ils formeront un compost riche en nutriments que vous pourrez utiliser l’année suivante. Attirez les insectes pollinisateurs et les prédateurs naturels en plantant des   et en laissant des  e pour soutenir la santé globale de l’écosystème de votre jardin. En préparant soigneusement votre jardin pour l’arrivée du printemps, vous créez les conditions idéales pour une saison de croissance réussie et épanouissante. Que vous soyez un jardinier novice ou expérimenté, ces conseils vous aideront à tirer le meilleur parti de votre espace extérieur tout en  Alors sortez vos outils, mettez vos gants et préparez-vous à accueillir une nouvelle année de verdure et de vie dans votre jardin."
