titre_article,category,titres_sections,texte
Quels sont les principaux outils pour réussir une pose de carrelage ?,Conseils & Astuces,1. Les outils du carreleur pour préparer son support | 2. L’outillage de carreleur indispensable en vue de l'installation | 3. Les produits nécessaires pour les finitions | 4. Les équipements de protection du carreleur,"La préparation du sol ou du mur est une étape incontournable. Elle permet d’obtenir une pose de qualité et qui dure de nombreuses années. Il faudra alors vérifier que son support soit propre, sain et sec avant de se lancer dans son projet. Lorsque l’on souhaite  , le support peut être horizontal ou vertical en fonction de si l’on veut recouvrir un sol ou un mur. Dans les deux cas, le support doit être plan et lisse. Si vous observez des défauts de planéité ou bien des imperfections (restes de mortier colle, graisses ou autres résidus), il faudra alors utiliser un ragréage. Voici quelques   nécessaires à la vérification du début de chantier :               Pas un chantier de pose de carrelage ne se passe sans que les traçages et les mesures n’interviennent à un moment de la réalisation. Ces étapes indispensables sont nécessaires afin d’obtenir un rendu soigné et de qualité. Le traçage est utilisé lorsque l’on souhaite découper des carreaux ou créer des lignes droites au sol. C’est alors que des mesures précises entrent en compte. Ces deux étapes sont complémentaires et la clé de la réussite de votre pose de carrelage. Pour cela, vous aurez besoin de quelques outils spécifiques :         La préparation du support comprend l’application du primaire d’accroche avant d’encoller ou de ragréer. En effet, une fois s’être assuré qu’il est propre, sec, sain et plan, le primaire va apporter une adhérence optimale. Ce produit offre une pose de carrelage qui traversera les années sans encombre. L’utilisation du primaire d’accroche est indispensable pour tout type de chantier (neuf ou rénovation). Pour appliquer le primaire, ces équipements vous seront utiles :       Une fois que le support a été contrôlé, que le calepinage est prêt et que le primaire est appliqué, il est temps de passer au cœur de la pose de carrelage. Encollage, découpe et pose des carreaux, découvrez les   pour ces étapes incontournables. En ce qui concerne la fixation des carreaux au sol ou au mur, il est nécessaire de procéder à l’encollage après avoir préparé le mortier colle. Voici les outils de carreleur qui vous aident dans cette démarche :                           Il est maintenant temps d’installer les carreaux ! Pour ce faire, faisons un zoom sur le matériel pour carreleur qui offre une véritable aide à la pose :         Poser le carrelage est une chose, mais un rendu impeccable s’obtient grâce aux finitions. Comprenez ici le jointoiement ou encore le nettoyage de fin de chantier. La finition d’une installation de carrelage passe forcément par le jointoiement. Cette touche finale peut changer du tout au tout le rendu et l’aspect décoratif. Pour réaliser les  , voici l’ensemble de l’outillage de carreleur qui sera nécessaire pour cette étape :             Pour un carrelage propre et étincelant après chantier, voici une étape à ne pas négliger ! Une fois la pose et le jointoiement effectué, il vous faudra utiliser un   afin d’enlever la laitance de ciment. En effet, ce produit spécifique vous aidera à faire disparaître le voile disgracieux déposé sur vos carreaux tous neufs. Pour l’utiliser, munissez-vous d’ , d’  et d’ . Vous aurez ainsi tous les équipements nécessaires pour nettoyer la fin de votre chantier de manière optimale.                 Votre boîte à outils spéciale carrelage est désormais complète ! Vous disposez de tout le matériel nécessaire au bon déroulement de la pose de votre revêtement et de vos travaux. Article réalisé en collaboration avec PRCI, TILES SOLUTIONS, TOMECANIC, NESPOLI, PAVILIFT et GERIN"
Quel carrelage extérieur pour un balcon ou une terrasse ?,Conseils & Astuces,Quelles sont  vos besoins et votre environnement ? | Comment choisir le bon matériau pour l'extérieur ?  | Quelles sont les caractéristiques techniques à prendre en compte ?  | Ne pas négliger l'esthétique : pour un espace extérieur à votre image | Astuces et conseils pratiques pour un projet réussi  | En conclusion,"est le produit qui es pour ce type de destination L’usage qui est prévu pour l’espace extérieur à carreler est déterminant pour choisir le bon produit. Voici quelques critères à définir : Le type de revêtement de sol que vous allez installé doit pouvoir supporter les aléas climatiques. Voici 2 éléments à prendre en considération dans votre choix: La terrasse ou le balcon sont de plus en plus considérés comme des pièces de la maison. Il est important que cet espace corresponde à votre style. 2 éléments seront à prendre en compte : 
 
         Découvrez les carreaux de carrelage pour sol extérieur Outre le matériau, plusieurs caractéristiques techniques doivent être prises en compte pour choisir le carrelage extérieur idéal : Prenez également en compte que le format aura un impact sur le budget du projet (notamment sur les marges à prendre en compte).     La norme UPEC donne des indication sur   : 
Plus le chiffre est élevé plus la résistance est forte Attention, la norme UPEC ne suffit pas à garantir qu’un carrelage est destiné pour l’extérieur. Le caractère non gelif est un autre critère à prendre en compte notamment. 
 Quelques conseils pour donner du style à votre terrasse : Afin de réussir votre chantier carrelage :"
Votre chauffage d’appoint d’intérieur prend soin de vous cet hiver,Conseils & Astuces,"1. Pourquoi s’équiper d’un chauffage d’appoint ? Quels sont les avantages ? | 2. Les différents types de chauffages d’appoint | 3.   Choisir le bon chauffage d’appoint pour son salon, sa chambre ou sa salle de bains | 4. Trouver la bonne puissance pour son chauffage d’appoint ","Fini le beau temps, vous êtes prêt(e) à enfiler vos chaussons, prendre un bon chocolat chaud et profiter du confort de votre logement. Mais encore faut-il ne pas grelotter sur votre canapé. Il est peut-être temps de trouver  . Il vous permettra de passer cette saison froide dans le plus grand confort. Mais quel chauffage d’appoint choisir ?  . Grâce à cet article, nous allons vous guider dans votre sélection. Lorsque l’hiver approche à grands pas et que vous sentez la température baisser, ou à l’intersaison,   peut se révéler d’une grande utilité. Ce dernier vous permettra de  , et pour un coût avantageux. Grâce à votre chauffage d’appoint, vous pourrez poser votre doudoune au placard en attendant la mise en route du chauffage central. Ce n’est pas tout, même lorsque votre chaudière est allumée,   pourra compléter le système déjà en place ou bien tempérer ponctuellement une pièce non chauffée. Notez bien qu’un   reste une solution complémentaire à une autre installation principale de chauffage comme une pompe à chaleur, une chaudière (fioul, gaz, granulés), un chauffage central, des radiateurs électriques, ou un chauffage au bois. Beaucoup d’options s’offrent à vous. Pour y voir plus clair voici les grandes familles de chauffages : Ce type de chauffage est particulièrement apprécié pour sa simplicité d’utilisation. Il se branche à une prise électrique, ne requiert pas un gros entretien et il existe sous plusieurs formes. Vous aurez donc de diverses possibilités, comme le . Il est idéal pour les petits espaces comme les chambres ou les bureaux. Selon les modèles et leur indice de protection il peut aussi être utile dans les salles d’eau car il chauffe rapidement. Peu encombrant et très léger, il est pratique à déplacer même à l’étage d’une habitation, mais aussi à stocker durant la période estivale. Pour que votre porte-monnaie reste au chaud lui aussi, il est proposé à un prix abordable. Toutefois, les radiateurs soufflants sont bruyants et peuvent dessécher l’air s’ils tournent longtemps, ils sont donc moins préconisés dans les chambres d’enfant par exemple.     Il existe également les convecteurs et rayonnants mobiles qui permettent de chauffer en un temps record, un espace plus grand que le soufflant comme le salon, la salle à manger, ou la cuisine. Malgré une tendance à assécher l’air, les convecteurs mobiles réchauffent rapidement la pièce.Apprécié pour son efficience, il existe également le panneau rayonnant qui diffusera mieux la chaleur, comme son nom l’indique par rayonnement. Il apporte un confort supérieur au convecteur. Ce choix sera idéal pour équiper une pièce de façon occasionnelle comme une salle de jeux, une chambre ou un salon.     Vous pouvez aussi opter pour un chauffage d’appoint à inertie afin d’obtenir une chaleur agréable et homogène sans assécher la pièce. Mais aussi, si vous souhaitez faire des économies à long terme et bénéficier d’un système de qualité. Si vous êtes soucieux de la décoration de votre foyer, notez que pour quelques euros de plus, il existe des designs innovants et élégants qui sauront se fondre dans vos espaces. Parmi ces solutions à inertie on retrouve les célèbres radiateurs bain d’huile. Leur fonctionnement est simple, l’huile contenue dans le radiateur est chauffée par convection. Il est parfait pour les grands espaces ainsi que pour un usage régulier. En effet, grâce au bain d’huile à inertie, la chaleur continue à être diffusée longtemps après son arrêt. Il apporte également une montée en température rapide et mobile tout en étant plus silencieux. De plus, il peut facilement être déplacé à l’aide de ses roulettes et de sa poignée de transport. Certains appareils peuvent être équipés d’un minuteur, d’un programmateur, d’un écran LCD facilitant la lecture de la température. Généralement ils proposent deux allures de chauffe, afin de réchauffer des pièces de superficie différentes. Ils sont tous équipés d’un système d’arrêt en cas de basculement et de surchauffe. Plus économique que l’électrique le   offre un bon rendement même s’il demande plus d’organisation. En effet, il impose de vérifier et de recharger la bouteille de gaz régulièrement. Dans le cas d’un usage intensif il est même recommandé de stocker une bouteille d’avance. Pour plus de praticité, il existe de grandes bouteilles ou de plus petites pour s’adapter à vos besoins et à votre espace. Il est certes moins esthétique, mais séduit par son autonomie. C’est aussi un chauffage très pratique en cas de panne de courant. Il existe différents modèles :     Il existe également deux types de   : le   et le  .    pour le séjour, va prioriser, une bonne puissance afin de réchauffer chaque coin de votre pièce, l’absence d’odeur et la qualité de la chaleur. En bonus un design en harmonie avec votre décoration. Le chauffage adapté à un usage régulier sera  . Ils disposent d’une bonne inertie et d’une puissance qui vous permettra de chauffer une pièce jusqu’à 30 m². Aussi, le poêle à pétrole électronique qui permet de chauffer rapidement y compris des pièces à grand volume >40m². On apprécie également leur fonctionnement économique, silencieux et programmable. Pour un usage occasionnel, privilégiez un convecteur mobile pour les espaces jusqu’à 20 m² ou un poêle à gaz   jusqu’à 40m². Rien de mieux que d’être confortablement installé dans sa chambre. Pour cela, quelques critères sont indispensables. Comme pour le salon, il faut une bonne qualité de chaleur et l’absence d’odeur. Une puissance conforme à la taille de la chambre est importante ainsi qu’un système sans danger pour garder les plus jeunes en sécurité. Il est aussi souhaitable d’avoir un appareil réglable pour choisir les heures stratégiques de chauffage. Nous vous conseillons donc : un    . Ce chauffage produit une chaleur douce et homogène dans la pièce. Souvent équipé d’un verrouillage parental, vous pourrez même aménager une chambre d’enfant sans aucune crainte. Il existe également des modèles programmables pour encore plus d’adaptabilité. Pour la salle de bains, le critère indispensable pour votre futur chauffage sera une montée rapide en température. Pensez aussi à choisir une puissance adaptée à la taille de la pièce et un appareil qui répond aux  Veillez bien au respect des volumes d’installation des appareils électriques dans une salle de bains (selon la norme NF C 15-100).   Notre conseil : le  . Cet appareil est très efficace pour réchauffer rapidement une petite surface. Il est également léger, peu coûteux et discret. C’est donc la solution parfaite pour une salle de bain.     Pour identifier son juste besoin en chauffage d’appoint, il faut se poser deux questions : L’emplacement géographique de votre habitation reste donc l’un des critères de sélection principal pour déterminer la puissance de votre chauffage d’appoint :     Afin de déterminer le besoin complémentaire pour la puissance de votre chauffage d’appoint."
Comprendre les nouvelles étiquettes énergétiques des sources lumineuses,Conseils & Astuces,Pourquoi l’étiquette énergétique a-t-elle été modifiée ? | Quels changements y a-t-il sur l’étiquetage des ampoules ? | Comment lire une étiquette énergétique ? | Quelles sont les performances des sources lumineuses ? | Quand ces nouvelles étiquettes énergétiques sont-elles mise en place ? | En résumé,"Ce changement concerne de nombreux produits, c’est pourquoi il se fait en plusieurs étapes. La base de données EPREL permet de générer les nouvelles étiquettes depuis le 1er Mai 2021 afin de préparer en anticipation ces dernières. Depuis le 1er septembre, les nouveaux règlements s’appliquent aux nouveaux produits mis sur le marché. Ils porteront donc déjà la nouvelle étiquette et cohabiteront avec les anciens produits d’abord munis de l’ancienne étiquette. Enfin, le 1er Mars 2023,   et le cas échéant les anciens produits seront réétiquetés afin de ne vous proposer qu’une seule et unique étiquette harmonisée sur tous les produits.  Pour finir, le 1er septembre 2023, de nombreux tubes fluorescents et produits halogènes seront interdits de mise sur le marché afin d’éliminer les lampes trop énergivores."
vmc hygro b ou double flux pour une maison neuve,Conseils & Astuces," Moisissures, isolation défaillante... Les signaux d'alerte |  Quelle VMC choisir pour sa maison neuve ?","Une maison neuve équipée d’une  , c’est la garantie d’un foyer sain. Découvrez nos préconisations afin de choisir le système le plus adapté à votre intérieur. Devenir propriétaire d’une jolie maison neuve signifie, pour la plupart d’entre nous, le début d’une seconde vie. Primo-accédants ou non, les beaux projets et les envies de bonheur partagé remplissent vos pensées. Afin de conserver votre havre de paix stable, rassurant et confortable des aménagements intérieurs et extérieurs sont nécessaires. Discret mais essentiel, l’un d’entre eux concerne l’ . En effet, combien d’entre nous se sont déjà trouvés confrontés à des moisissures dans leur salle de bains ? En dépit d’une idée très commune, la présence d’une fenêtre dans cette pièce de la maison est insuffisante pour éviter les désagréments d’une mauvaise aération. Si, comme dans cet exemple, l’une de vos pièces ou même votre domicile entier présente des signes de dysfonctionnement d’aération, il est urgent d’y remédier. Pour vous aider à déceler une mauvaise ventilation de l’air, prêtez attention à vous murs ainsi qu’aux zones proches de vos fenêtres. Certains phénomènes très communs sont en réalité de mauvais présages. Voici quelques signaux d’alerte à prendre en considération :   Au -delà des désagréments esthétiques engendrés par la mauvaise ventilation, ces signes sont aussi dangereux. En effet, ces dommages matériels ont aussi pour conséquence de provoquer des problèmes de santé tels que : Elle garantit la qualité de l’air intérieur, protège la maison et ses habitants. Ainsi, il est essentiel de choisir la bonne VMC pour votre logement, en fonction de ses caractéristiques Tout d’abord, la ventilation d’un logement doit être générale et permanente. Les 2 types de VMC abordées ici sont la simple flux hygro B et la double flux. Pour choisir la plus adaptée à votre usage, il est indispensable de comprendre deux notions importantes Les VMC hygroréglables sont des ventilations simples flux. Elles gèrent uniquement l’évacuation de l’air. On caractérise l’installation hygro A ou B selon les entrées d’air. Dans cet article, la VMC Hygro B dont nous parlons est certifiée QB. Cette certification autorise son installation dans les habitations neuves (RT2012). La VMC Hygro B va réguler le débit d’air en fonction des besoins pour chaque pièce humide.  :   Le caisson, muni d’une seule vitesse, aspire l’air intérieur par les bouches installées dans les pièces de service. Ce mouvement permet de créer une dépression : l’air extérieur entre dans le logement via les entrées d’air. Les bouches installées dans chaque pièce humide vont réguler leur débit. Grâce au détecteur d’humidité intégré, la bouche s’ouvre plus ou moins en fonction de celle-ci. La VMC hygro B comporte en plus des entrées d’air, elles aussi régulées, permettant une gestion plus fine de l’humidité dans la maison.   En quelques points, voici les   :   Choisir une  , c’est s’assurer d’avoir une meilleure ventilation de l’air dans son logement. Contrairement à une VMC simple flux, elle est en effet capable de gérer l’évacuation, mais aussi l’aération de la maison.  :       Non-obligatoire mais vivement conseillée dans les zones où l’hiver est rude, la batterie de préchauffage génère des économies de chauffage et augmente l’efficacité du système. 
En amont de l’échangeur, elle évitera que les condensats ne gèlent et ralentissent les performances. 
En aval de l’échangeur, la batterie de préchauffage permettra de contrôler la température de l’air neuf diffusé dans les pièces principales. Ainsi, vous profiterez d’un bon confort thermique."
S’équiper d’un bloc multiprise écoresponsable,Conseils & Astuces,1. Qu’est-ce qu’un bloc ménager ? | 2. Les blocs ménagers écoresponsables,"Aujourd’hui, nos intérieurs voient fleurir de plus en plus d’appareils électriques. Ajouté à cela les changements de nos habitudes de vie, comme le télétravail et l’on comprend l’importance d’être bien installé tout en étant proche d’une prise électrique. En effet, il faut pouvoir alimenter nos téléphones, ordinateurs et autres, c’est alors que vous découvrez que votre doux foyer manque de prise de courant. Face à ce besoin croissant,   se sont invitées dans vos intérieurs et ont connu de belles évolutions. Profitez de leurs nombreuses options pour aller vers l’économie d’énergie et davantage de sécurité. Retrouvez ici tous nos conseils d’expert pour bien choisir votre multiprise écoresponsable. Un  , aussi appelé   permet de faciliter le branchement des appareils électriques dans les espaces intérieurs. En effet, il vous permet de démultiplier les prises de courant. En branchant un   sur une prise murale, vous obtenez 6 emplacements électriques au lieu d’un. Attention toutefois de bien respecter les normes d’usage afin d’éviter une surtension qui pourrait endommager vos appareils, voire déclencher un incendie.   Ce produit peut paraître basique, pourtant, il propose diverses déclinaisons qui peuvent s’avérer très pratiques pour l’aménagement de vos espaces de vie. C’est pourquoi, lors du choix de votre multiprise, il y a plusieurs questions à vous poser sur l’usage que vous souhaitez en avoir, sa fréquence d’utilisation, sa pièce de destination etc… Pour commencer, de   Le plus souvent, elle se décline en bloc de deux à six prises électriques disponibles. Souhaitez-vous  Si c’est le cas, intéressez-vous aux modèles équipés de port USB. Allez-vous  , ou va-t-elle servir pour du dépannage ponctuel ? Si elle reste en place, un interrupteur pourrait être utile. Il peut également être judicieux de prendre quelques mesures afin d’opter pour le modèle de multiprise qui vous convient le mieux. Effectivement, les  . Ainsi, vous pourrez adapter la longueur de fil de la multiprise à la longueur dont vous avez besoin entre votre prise murale et vos appareils électriques. Il faut aussi décider   en fonction des appareils qui vont y être branchés. L’intensité maximale d’un bloc ménager est indiquée sur le produit et ne dépend pas seulement du nombre de prises. Vérifiez sur l’étiquette énergétique des appareils à raccorder, quelle est leur consommation et s’ils peuvent tous être branchés simultanément sans dépasser la puissance autorisée par la multiprise. La démocratisation de l’usage des blocs multiprise a accéléré le développement de ces derniers. C’est pourquoi, vous trouverez des  . Ces produits répondent parfaitement aux problématiques ergonomiques, esthétiques et fonctionnelles induites par l’activité dans certains lieux comme la cuisine par exemple. Une multiprise standard posée sur votre plan de travail n’est pas stable et occupe un grand espace inutilement, c’est pourquoi nous vous conseillons de choisir une  . Elle pourra être cachée sous le plan de travail et être déployée au besoin. Si vous ne souhaitez pas percer ce dernier, il existe des   à poser. Elles occupent moins d’espace et offrent une plus grande stabilité, car elles sont appuyées contre le plan de travail et la crédence, permettant ainsi un branchement des appareils à une main. Vous trouverez également des   sur pieds, à poser ou à visser au mur. Pour les petits espaces, pensez aussi à la   de forme cubique. L’électroménager de cuisine comme la cafetière, le grille-pain ou le four micro-ondes consomment beaucoup d’énergie (environ entre 1000 W et 1500 W chacun), soyez vigilent à la  Dans le bureau, c’est parfois le fouillis avec des enchevêtrements de câbles d’alimentation dans tous les sens, faisant de la traversée de la pièce une véritable épopée. Il faut dire que c’est l’une des pièces qui héberge le plus d’appareils électriques. Ordinateur, écran déporté, imprimante, lampe de bureau, box internet, téléphone… Cela fait beaucoup ! Les modèles de   sont aussi de bons accessoires pour alimenter le bureau. Les   et d’angle sont efficace tout comme les  . Pensez aussi aux   qui facilitent l’accès aux prises et se camouflent bien derrière un écran d’ordinateur par exemple. Nous conseillons de favoriser les  , ce qui vous permettra de recharger les petits appareils sans occuper une prise électrique. Préférez aussi les blocs avec des prises orientées à 45° qui permettent de brancher de gros chargeurs sans condamner la prise voisine.   Enfin, les appareils de bureau n’ étant utilisés pour la plupart que quelques heures par jour, une vous permettra de les couper en un clic le reste du temps.  Certaines formes de plastique comme le polypropylène, sont plus  . En effet, ce dernier fait partie de la famille des thermoplastiques. Ces plastiques se forment sous la chaleur puis durcissent de manière réversible ce qui les rend réutilisables et donc  . De plus, le polypropylène peut être recyclé plusieurs fois au cours de son cycle de vie. Autre avantage, lorsqu’il sera incinéré, il ne dégagera en brûlant, que du dioxyde de carbone et de la vapeur, sans émettre de substances toxiques. Au-delà de sa résistance, c’est aussi son côté recyclable qui invite les fabricants à proposer des   comme la  . Choisir une   est un geste écologique et économique, car il permet d’offrir une nouvelle vie à la matière plutôt que de l’incinérer.  En effet, certains produits comme le boîtier de la   par exemple, sont fabriqués avec 80% de plastique (polypropylène) « recyclé ». Notez bien que dans sa globalité, on peut considérer que la multiprise Zenitech est constituée de presque 40% de matériaux recyclés ? De plus, son coloris atypique et moucheté lui confère un style unique qui s’adaptera à tous les intérieurs. Le saviez-vous, quasiment tous les appareils électriques éteints qui restent branchés, consomment de l’énergie. Laisser ces appareils en veille n’est donc pas idéal si vous souhaitez réduire votre empreinte écologique. En effet, cela représente 11% de la consommation d’électricité moyenne annuelle de chaque foyer français.   contribue à éviter les surconsommations inutiles des appareils non utilisés et restés en veille. Il vous permet de débrancher en un clic les appareils qui y sont connectés et ainsi réduire votre consommation électrique. Les interrupteurs sont généralement munis d’un voyant lumineux afin de repérer instantanément si le bloc ménager est allumé ou éteint. Écoresponsable, sur la  , cette bague est en fait un simple repère visuel, un indicateur passif de marche, elle ne consomme pas d’énergie comme le ferait un voyant lumineux. En résumé, le   est un produit qui a tout de vert sauf sa couleur !"
