titre_article,category,titres_sections,texte
Traitements spécifiques de vos supports de sols et murs : le guide pratique,Conseils & Astuces,Traitements spécifiques pour les murs | Traitement spécifiques pour les sols | Conclusion,"Lorsque l’on se lance dans un projet de construction ou de rénovation, les travaux peuvent parfois prendre de grandes ampleurs. Qu’il s’agisse de l’étape de  ou de celle de la pose d’un nouveau revêtement, les  sont essentiels. En effet, ceux-ci garantissent la durabilité, le rendu esthétique et final, ainsi que la fonctionnalité. Notre guide dédié à ces  vous aidera à comprendre et à maîtriser les techniques avancées nécessaires pour traiter vos sols et murs comme un pro. Pièces maîtresses d’une habitation, les murs sont ceux qui sont le plus amenés à être rénovés ou décorés. Peinture, papier peint ou même  les murs sont un support rêvé, mais qui nécessite parfois d’être nettoyé ou réparé. Ainsi, les murs exigent des traitements spécifiques avant de procéder à la finition souhaitée. La pose d’un papier peint sur un mur fait partie des travaux les plus fréquents en matière de décoration. Dans les travaux de rénovation, cela implique nécessairement d’enlever l’ancien revêtement. Durant cette opération, il n’est pas rare que quelques coups de spatule ne fassent malencontreusement quelques trous dans le murs ou que des résidus de papiers persistent. Une   est donc nécessaire pour rendre la surface parfaitement propre, lisse et sèche. En ce qui concerne les trous ou les fissures, il convient d’utiliser un  ou de lissage selon la profondeur de coups. Avant de peindre ou de poser un revêtement mural, assurez-vous que la surface soit propre, sèche et lisse. Utilisez un apprêt pour améliorer l’adhérence de la peinture ou du revêtement. Lorsque l’enduit est sec, vous devrez probablement repasser un léger papier de verre pour supprimer le surplus . Cette opération a pour but de rendre la surface de votre mur parfaitement plane. Tout comme pour les sols, ce   vous garantit une application parfaite et sans défaut de votre papier peint ou de votre peinture. Si vous choisissez de poser du papier peint, veiller à prendre en compte la nature du papier peint. S’agit-il d’un papier peint intissé ou non ? En effet, la  va en dépendre. La   s’applique directement sur les murs. Veillez à encoller directement sur le mur, sur seulement la largeur de quelques lés, et appliquer les lés directement sur le mur. Si vous devez poser de la peinture, suivez les instructions du fabricant pour obtenir les meilleurs résultats. Regardez notamment s’il s’agit de la peinture monocouche ou non.  Selon la nature des peintures et de votre support mural, vous devrez peut-être appliquer une sous-couche, voire un primaire d’accrochage. Les sols subissent une usure quotidienne intense, il est donc essentiel de les traiter correctement. Voici comment procéder : Chaque pièce répond à un besoin et à une ambiance bien particulière. C’est pour cette raison qu’il est essentiel de sélectionner un revêtement de sol approprié en fonction de la pièce, de l’utilisation et de votre esthétique préférée. Les options courantes incluent le carrelage, le parquet, le béton poli, le vinyle, etc. Outre l’aspect esthétique, le choix du revêtement du sol va dépendre aussi du  et les traitements spécifiques dépendront alors, du revêtement, mais aussi du support sur lequel il va être posé. Lorsque l’on pose du carrelage ou un plancher flottant, il est nécessaire de s’assurer du bon état du support principal. Dans le cas d’un carrelage, vous pourrez le poser sur une chape sèche ou sur un ancien carrelage. De fait, vous devrez vous assurer que la surface est bien plane ou procéder aux  . Si vous désirez poser un parquet flottant, vous devrez utiliser des  pour réaliser une sous-couche. Assurez-vous que le sous-plancher est propre, sec, plan et exempt de tout dommage. Réparez les fissures ou les inégalités si nécessaire. Utilisez une barrière contre l’humidité si le sol est exposé à l’humidité. Quelles que soient vos envies de décoration, il vous faudra respecter les  . Généralement, elles portent sur les méthodes de fixation (collage, clouage). Suivez attentivement les instructions du fabricant pour l’installation du revêtement. Utilisez les outils appropriés, tels que des coupe-carreaux, des   ou des niveleuses pour garantir une installation précise et professionnelle. Tout au long de la pose, nous vous conseillons de vérifier également que la surface de votre revêtement reste bien plane et de niveau. Ceci demeure essentiel pour garantir le bon rendu esthétique de votre pièce. Une fois le revêtement en place, appliquez les finitions nécessaires, comme la vitrification pour le parquet ou le scellant pour le carrelage. Dans le cadre de la vitrification d’un parquet, l’application du   se faire dans le sens du fibre de bois. Elle s’effectue au moyen d’un rouleau spécial. Il convient par la suite de respecter un temps de séchage de 2 heures. En ce qui concerne le carrelage, la pose d’un scellant (notamment dans les pièces humides) garantit une bonne étanchéité du sol. Assurez-vous de nettoyer et d’entretenir régulièrement votre sol afin de prolonger sa longévité. Les traitements spécifiques de vos supports de sols et murs sont des étapes cruciales dans tout projet de rénovation ou de construction. En suivant les   appropriées, en sélectionnant les matériaux et les techniques adéquates, et en appliquant des finitions de qualité, vous obtiendrez des résultats professionnels qui dureront longtemps. Avec ce guide, vous êtes maintenant prêts à relever le défi et à transformer vos sols et murs en véritables œuvres d’art fonctionnelles."
Bien choisir ses plaque de plâtre – Aménagement de cloison intérieur,Conseils & Astuces,"Bien choisir sa plaque de plâtre en fonction de la pièce et de l'usage | Quelle plaque de plâtre pour les pièces sèches (chambre ou séjour) | quelle plaque de plâtre pour les salle de bains ou autres pièces humides ? (salle de  bains notamment) | Quelle plaque de plâtre pour une pièce bruyante ? (chambre d'enfant, salon) | Quelle plaque de plâtre pour les pièces exposées á la chaleur ? | Quelle plaque de plâtre pour salle exposeé aux chocs  ou resitant aux charges lourdes. | Choisir les plaques de plâtre en fonction du type de pose | Quelles sont les differents types de plaque de plâtre ?","pour salle de bains Pour insonoriser une chambre d’enfant, une salle de musique ou tout autre pièce, optez pour des plaques acoustiques. Conçues pour isoler du bruit, les plaques de plâtre acoustiques offrent des indices d’affaiblissement sonore intéressants. Notez que les plaques de plâtre acoustiques sont de couleur bleue.          aussi appelées plaques résistantes, résistent aux impacts. Pour cette raison, elles sont préconisées pour les pièces à fort passage (locaux à usage collectif). Elles sont tout aussi intéressantes pour les particuliers souhaitant un matériau plus solide. Ces plaques sont aussi adaptées pour la pose de support à TV par exemple. A noter que les plaques de plâtre résistantes sont de couleur jaune.         Plus d’articles sur ce sujet :"
Comment bien entretenir mon chauffe-eau électrique ?,Conseils & Astuces,Comment fonctionne un chauffe-eau électrique ?   | Les 2 ennemis du chauffe-eau,"Bien que ce ne soit pas la première idée que nous ayons en tête lors de son achat, sachez que l’absence d’ peut vite devenir un véritable souci. En France, ce sont 50 % des 30 millions de ménages qui sont équipés d’un ballon d’eau chaude électrique. Chaque année, cela représente 1,3 million d’appareils remplacés*. Avec toutes les conséquences financières et écologiques que cela engendre, il peut être intéressant de réfléchir à une nouvelle façon de composer avec son chauffe-eau. Alors, comment mieux l’entretenir pour le garder en état aussi longtemps que possible ? Voyons tout d’abord comment fonctionne votre appareil pour appréhender au mieux ses besoins. Le   à accumulation (équipé d’une cuve) a pour fonction de produire de l’eau chaude pour les occupants d’un logement, notamment pour les sanitaires et la cuisine. Il sera dimensionné en fonction du nombre d’occupants ou encore du type de sanitaire. En règle générale, nous comptons 50 L d’eau/jour/personne (ex : 4 pers ~200 L). Notez qu’en France, un chauffe-eau est souvent chauffé 8 heures/24 heures, pendant les heures creuses car l’électricité y est moins chère. Pour mieux comprendre les différents éléments qui composent votre ballon d’eau chaude et quelles parties sont à entretenir, vous trouverez ci-contre un schéma explicatif. Lors de l’achat et de la mise en marche de votre chauffe-eau, vous devrez obligatoirement installer sur le tube eau froide du chauffe-eau un groupe de sécurité. Ce dernier aura pour fonction de réguler la pression à l’intérieur de la cuve. Nous vous recommandons de manipuler la molette de vidange une fois par mois pour éviter l’entartrage. En cas de dysfonctionnement du groupe de sécurité, le chauffe-eau peut être endommagé. Les deux principales causes d’usure d’un ballon d’eau chaude sont le   et la  . Inévitables dans le cycle de vie de votre appareil, il existe néanmoins plusieurs solutions pour retarder l’usure. Afin de vous aider à déterminer la qualité de votre eau, vous trouverez ci-dessous une carte présentant les caractéristiques des différentes régions françaises : 
 Pour pallier l’usure de votre ballon d’eau chaude liée au calcaire, il vous faudra choisir la bonne résistance. Elle permettra de limiter l’  du chauffe-eau et faciliter son entretien.   L’élément chauffant étant l’actif principal de votre appareil, il est important de bien le choisir. Voici les 3 types de résistances qui vous permettront de produire de l’eau chaude. La  est faite de cuivre, élément chauffant qui, en contact direct avec l’eau, va lui transmettre la chaleur. Elle a pour principal avantage de réduire le temps de chauffe, ce qui vous permet de bénéficier rapidement et durablement d’une eau chaude. Vous pourrez par exemple opter pour un mini chauffe-eau  , au design élégant et idéal pour vos éviers. Il vous offrira une eau chaude en 25 minutes et grâce à sa petite taille, il génèrera moins de calcaire que les plus gros volumes. En effet, les chauffe-eaux d’une plus grande capacité et disposant d’une résistance thermoplongée développeront du calcaire. Cela s’explique par l’appétence de ce dernier à se développer dans les eaux chaudes. Cette résistance générant plus de chaleur que les autres typologies, elle cause alors un fort et rapide entartrage. C’est naturellement que vous devrez porter plus d’attention à l’entretien de votre chauffe-eau en choisissant une résistance blindée. De plus, votre ballon d’eau chaude nécessitera d’être vidangé si vous devez remplacer ou entretenir la résistance. La   fonctionne de la même manière que le précédent modèle, à la différence de son émail. Ce dernier offre une meilleure protection contre le calcaire que la résistance blindée. Vous obtiendrez ainsi un meilleur rendement. Le point faible reste le même, à savoir la nécessité de vidanger en cas de remplacement.   Retrouvez notre gamme de  , qui propose une résistance thermoplongée émaillée.     La troisième typologie d’élément chauffant existante sur le marché est la  . Elle est placée dans un fourreau émaillé qui empêche son contact direct avec l’eau. Ajoutez à cela une surface chauffante plus étendue que celle de ses concurrentes, ce qui génère moins de chaleur au cm². Le fourreau émaillé permet donc de limiter la formation de calcaire mais aussi son adhérence sur la résistance, qui est protégée par l’aspect lisse de l’émaillage. La résistance stéatite apporte donc plusieurs avantages comme une chauffe silencieuse ou encore un entretien et une utilisation facile. En effet, cet élément chauffant ne demande pas de vidange lors de son remplacement ! Retrouvez nos gammes de chauffe-eau   ou  , qui proposent toutes deux une résistance stéatite. Pour contrer l’apparition de calcaire, nous vous invitons à privilégier des résistances thermoplongées émaillées ou idéalement des résistances stéatites si vous vivez dans une région proposant une eau très calcaire.       La   est causée par une eau trop agressive, entre 0 et 8°f (°f=degré français). Cette rouille va ronger la cuve et causer d’éventuelles fuites. En cas de fuite, votre chauffe-eau ne pourra plus être réparé. C’est en choisissant la bonne anode que pourrez pallier la corrosion.   Elle est considérée comme ayant un fonctionnement « passif ». Cette anode se situe dans l’eau et attire la rouille. Elle protège donc la cuve de la corrosion mais se sacrifie. Elle se change en moyenne tous les 2 ans. Il est donc nécessaire de la remplacer régulièrement et de contrôler son état tous les ans. Ces deux opérations nécessitent la vidange de l’appareil, ce qui s’avère technique et peut nécessiter l’appel à un professionnel. Attention, si l’anode est rongée, la garantie de votre chauffe-eau peut s’occulter. L’anode présente dans votre chauffe-eau aura pour rôle de  . Vous trouverez deux typologies d’anodes proposées sur le marché.     Pour une protection anti-corrosion plus efficace et donc pour simplifier l’entretien de votre chauffe-eau, nous vous invitons à privilégier une anode en titane. Retrouvez nos gammes de chauffe-eau   ou  , qui proposent une double protection anti-corrosion (anode en titane + magnésium).       Vous connaissez à présent les deux éléments sur lesquels vous pouvez jouer afin d’entretenir au mieux votre chauffe-eau. Si vous utilisez un adoucisseur, veillez à rester bien informé et contrôlez la dureté de votre eau (le TH). Ce sont ces éléments qui vous permettront de profiter au maximum de votre appareil. Notez qu’il est nécessaire d’avoir un TH 12 au minimum si vous possédez un chauffe-eau électrique. Autrement, vous prenez le risque d’occulter la garantie de la cuve. Pour contrôler votre eau, vous retrouverez nos kits de test dans la partie « traitement de l’eau » de notre site."
Rénovation et nivellement des supports : comment s’y prendre,Conseils & Astuces,Les différentes étapes de la rénovation et nivellement des supports  | Égaliser un sol ou un mur pour faire disparaître les inégalités  | Niveler un sol sans couche primaire ni mortier,"Poser un revêtement sur un sol est l’une des dernières étapes dans des travaux de construction ou de rénovation. Que l’on choisisse de poser de la moquette, du parquet ou encore un sol PVC, cette étape nécessite une   minutieuse. En effet, de la   va dépendre le rendu final, la tenue et la qualité de votre pose de revêtement. On peut même dire que c’est cette phase de préparation qui est la plus importante. Alors, comment réussir la rénovation et le nivellement des supports ? Découvrez dans ce guide les comment préparer un sol avant la pose d’une moquette, d’un parquet ou d’un sol vinyle Toute phase de travaux commence par un état des lieux et un diagnostic du présent pour diagnostiquer ce qui doit être entrepris. Ainsi, avant tout travail sur un support, il convient de faire un examen minutieux de son état. Il y a-t-il des fissures, des irrégularités ou encore des zones endommagées ? La surface est-elle vraiment plane ou existe-t-il des différences de niveaux ? Le support est-il suffisamment solide pour supporter un revêtement un peu lourd et présente-t-il des traces d’humidité ? Pour réaliser un diagnostic d’humidité, aidez-vous d’un  . Une fois ce diagnostic établi, il peut être nécessaire de renforcer la préparation des supports avec un nettoyage et décapage des supports, une réparation des fissures ou encore une égalisation ou ragréage. Parfois quand les problèmes sont trop importants, un  sera nécessaire. Le traitement d’un sol peut différer selon son état. S’il présente de petites inégalités ou de légères zones endommagées, une égalisation avec des   ou du   peut suffire. Ce traitement suffit parfois pour traiter les problèmes et pour permettre la pose d’un nouveau revêtement. Dans le cas où les dégâts ou les irrégularités sur un sol sont plus importants, il conviendra de refaire un sol ou refaire une chape en ciment ou béton. Sur les murs, il est nécessaire d’utiliser des enduits de rebouchage ou des enduits de  lissage. Avoir recours à un composé de nivellement permet de simplifier les travaux. D’une part en minimisant les couches et d’autre part, car le traitement est beaucoup plus rapide. La chape quant à elle, sera utilisée pour niveler le sol, mais également pour le rendre plus stable. Veillez toutefois à la hauteur sous plafond, la chape ayant une hauteur plus importante qu’une simple pose d’un enduit de nivellement. Lors du diagnostic de l’état du sol, il est important de déterminer si le sol présente des détériorations majeures ou s’il présente simplement des différences de niveaux ou qu’il est de travers. Dans ce cas, un simple nivellement du sol suffit. Avant de procéder au   à proprement parler, il convient de réaliser quelques travaux préparatoires comme un   ou encore un nettoyage afin de le débarrasser de la poussière ou des résidus de matériaux éventuels. Par ailleurs, vous devrez vous assurer d’avoir rebouché toutes les fissures, mêmes les plus infimes. Avant de  il est nécessaire de procéder à l’application d’un  . Cet apprêt enrichi de sable de quartz constitue une sous-couche adhésive. Cette dernière, garantit une très bonne liaison entre la pâte de nivellement et le sol. Cet apprêt s’applique facilement au moyen d’un rouleau ou d’un pinceau pour les plus petites zones. Si le besoin de rénovation du sol ne porte que sur quelques zones bien définies, il n’est peut-être pas nécessaire de procéder à un nivellement complet. Dans ce cas, une simple application d’un  sur les zones endommagées peut suffire. Le ragréage peut s’avérer être une très bonne alternative à un nivellement à base de mortier. En effet, plus fluide que celui-ci, le ragréage s’applique sur le support à l’aide d’une lisseuse et ce une fois la couche primaire sèche. Les procédés de des supports diffèrent selon la nature de ceux-ci. Par exemple, sur un support en plancher, il n’est pas possible d’utiliser du béton ou du mortier. Toutefois, il est possible d’utiliser d’autres matériaux Dans certaines vieilles habitations, il est possible de rénover et niveler un parquet déformé avec des . Ces plaques constituent une chape complètement sèche, idéale lorsque l’on ne peut pas avoir recours à une solution humide. Leur application se fait sur une couche de billes expansées ou de granulés végétaux et il suffit ensuite de les visser entre elles. Une fois cette “chape sèche” réalisée, il est possible d’installer un nouveau revêtement comme une moquette ou un parquet flottant. Outre le fait de permettre de réaliser facilement le nivellement d’un sol comme un plancher, les sous-couches en iso-feutre apportent également une isolation phonique et thermique. Partie intégrante d’une  elles permettent de procéder à la pose immédiate d’un revêtement. Tout comme avec les plaques de Fermacell, les plaques en OSB ou agglomérés représentent une bonne alternative à un nivellement avec du béton ou du mortier. Constituant elles aussi, une chape sèche sur laquelle vous pourrez poser un nouveau revêtement sur votre sol. Néanmoins, elle nécessite de surveiller le niveau avec un laser pour s’assurer de leur planéité. En conclusion, la   peut se faire facilement à condition d’avoir procéder au préalable à un bon diagnostic. C’est ce dernier qui déterminera vers quelle   s’orienter et quel procédé sera le plus adapté. De plus, prenez en compte l’épaisseur du nivellement avant de choisir votre procédé, ainsi que la nature de votre sol."
