titre_article,category,titres_sections,texte
Les conseils de base à connaître pour poser des lames de terrasse,Conseils & Astuces,L'emplacement de la terrasse | La question du support | Matériel nécessaire à la pose des lames | Vérification des lames,"Pour profiter de votre jardin, rien de tel qu’une terrasse en bois. Voici un guide pour bien préparer la pose de votre terrasse. La première étape à réaliser pour votre projet terrasse est de  Cela peut paraître futile mais il y a plusieurs facteurs à prendre en compte pour trouver l’emplacement idéal dans votre jardin. Attention, avant tout projet de terrasse, il est essentiel de prendre connaissance auprès de votre mairie s’il est nécessaire de déposer une déclaration de travaux ou s’il faut un permis de construire. Pour toutes les terrasses excédant 60 cm de hauteur, il est nécessaire de faire une déclaration de travaux ou d’avoir un permis de construire auprès de votre mairie.             , il convient d’être bien outillé avant de se lancer dans ce chantier. Comme principaux outils, nous retrouvons   c’est-à-dire une visseuse-deviseuse, un mètre, une règle, un niveau, une équerre ainsi que les équipements de protection comme les lunettes et les gants. Ces outils sont indispensables à la pose d’une terrasse et peuvent servir à tous types de travaux allant du gros chantier aux petites réparations de la maison. Lors de la pose, vous allez sans doute découper des lames en fonction de votre espace, c’est pourquoi il est nécessaire d’avoir une scie à onglet ou une scie sauteuse pour effectuer des coupes précises et propres.   Le nombre de vis utilisées lors de la pose dépend des lames et du support de pose, c’est pour cela qu’il est variable selon le projet. Concernant la vis qui n’est pas à négliger pour un bon maintien de votre terrasse,  Pour Une fois que vous avez choisi vos lames, il est important de vérifier avant la pose de votre terrasse que  . Il arrive parfois que les lames soient endommagées au fil du temps. Lors de l’achat, il est aussi préférable de"
Bien prévoir le matériel pour réaliser et budgéter une terrasse en bois,Conseils & Astuces,Calculer le nombre de lames et de lambourdes nécessaires pour une terrasse bois | Comment calculer le prix d'une terrasse en bois ? ,"Vous cherchez à embellir votre extérieur ? Pour cela rien de mieux qu’une terrasse en bois ! Mais comment calculer le nombre de lame par m², le nombre de lambourdes ? quels sont les accessoires indispensables pour réaliser la pose dans les meilleures conditions. Et surtout combien peut coûter la réalisation d’une terrasse en bois ou en composite ? Voici un article présentant les différentes essences de bois en fonction du prix au m2, le prix d’une structure de terrasse et de la quantité à prévoir selon le projet. Afin de pouvoir  à la réalisation de votre projet, il est important : La réalisation d’un calepinage est toujours intéressante à réaliser. Voici un   pour la réalisation d’une terrasse bois.   Par ex : pour une terrasse de 20 m² et une lame de 0,6 m², compter 37 lames (le calcul donne 33,3  lame + 10%) , il est possible selon la dimension de la lame, de choisir un modèle plus long que la terrasse. Cela permettra d’avoir  (mais forcément plus couteux). Il est également possible de choisir des lames plus larges et qui par nature couvriront plus d’espace et demanderont moins de lames à poser et à découper (gain de temps). Voici un   pour une terrasse en bois Rappel : La structure des lambourdes comprend le tour de la terrasse + les rangées « intérieures »   Par ex pour une terrasse de 30 m² qui mesure 6 x 5 m avec un espace de 40 cm voici le calcul :  va dépendre du matériel qui servira à sa réalisation soit : Tous ces éléments sont à prendre    Le choix des lames de terrasse sera l’élément (après la surface) le plus impactant dans le budget à prévoir car selon l’origine, l’essence et la dimension, les prix varient, la qualité / durée de vie aussi.         Les terrasses en bois créent un espace chaleureux et authentique. Il existe différentes essences de bois qui ont leurs propres caractéristiques pour les découvrir, nous vous proposons un article sur les différents types de bois pour une terrasse.  se calcule en fonction du mètre linéaire qui se situe entre 3 à 10 euros pour les lambourdes. Pour calculer le nombre de lambourdes à utiliser, il faut    sont à prévoir lors de la pose, c’est sur ces lambourdes que vont reposer les lames de terrasse assurant la stabilité et la durabilité de l’ensemble de la structure. Il est donc important de choisir des lambourdes de bonne qualité avec une essence de bois assez dense et robuste. Ils existent différentes essences de bois en matière de lambourde comme le pin, le sapin ou encore en composite et en thermo-chauffé. Ces lambourdes sont traitées contre l’humidité pour assurer une pérennité au cours du temps. Pour assurer la protection des lambourdes, ils existent des bandes à coller qui protège la lambourde de l’humidité et des ruissellements d’eau de pluie. Le nombre de lambourdes nécessaire pour la pose d’une terrasse dépend de l’espace entre les lames et des chutes. Tous les produits et accessoires pour monter une terrasse en bois  sont considérés comme la solution la plus simple pour la pose d’une terrasse notamment grâce au fait qu’ils soient réglables ce qui laisse une marge de manœuvre pour l’écoulement des eaux pluviales.  coûte e  ce prix varie selon la hauteur et la dimension du plot. Pour la pose des plots, il faut généralement entre 4 à 9 plots par mètre carré selon la configuration de la terrasse, l’espacement entre les lambourdes et la  nécessité de réaliser en double lamboudage. Un calepinage peut vous aider à avoir une notion plus précise des quantités utiles. Il est possible d’utilisé des plots en béton mais la mise à hauteur et niveau seront plus compliquées. Pour la pose d’une terrasse, il convient d’être bien outillé avant de se lancer dans ce chantier. Comme principaux outils, nous retrouvons les indispensables du bricoleur, c’est-à-dire une ainsi que les équipements de protection comme   et  Ces outils sont indispensables à la pose d’une terrasse et peuvent servir à tous types de travaux allant du gros chantier aux petites réparations de la maison. Lors de la pose, vous allez sans doute découper des lames en fonction de votre espace, c’est pourquoi il est nécessaire d’avoir une   ou une   pour effectuer des coupes précises et propres.   Le nombre de vis utilisées lors de la pose dépend des lames et du support de pose, c’est pour cela qu’il est variable selon le projet. Concernant la vis qui n’est pas à négliger pour un bon maintien de votre terrasse, il faut que sa longueur représente 2.5 fois l’épaisseur des lames en bois. Pour la fixation des lambourdes et des lames utilisez uniquement des vis en inox.   Pour faciliter la pose et avoir un rendu plus esthétique, il est possible d’utiliser des clips qui seront positionnés entre les lames.  que vous aurez choisis."
Comment entretenir une terrasse en bois,Tutos,Pourquoi entretenir sa terrasse en bois ? | Comment entretenir des lames en bois naturel ?  | Comment entretenir des lames composites ? | Comment entretenir des lames exotiques ?,"Au cours de leur utilisation, les lames de terrasse sont exposées aux intempéries, aux variations de température, mais aussi à la pollution. Cette dernière favorise le développement de mousse et d’un film de saletés pouvant s’incruster dans le bois et ainsi altérer la couleur d’origine en ternissant vos lames. Vous avez certainement déjà aperçu des terrasses grisées dans d’autres extérieurs, le manque d’entretien en est sûrement la cause.  tant du point de vue technique qu’esthétique. Les facteurs salissants doivent être combattus, mais l’idéal reste la prévention. Vous pouvez par exemple appliquer un produit indiqué en particulier  de votre sol. Ensuite, l’entretien devra être régulier, il  , luttera contre son grisonnement et elle conservera dès lors tout son cachet. Le choix d’un bon produit de qualité est crucial, sous peine d’étouffer le bois et d’en abîmer la couleur d’origine En termes de fréquence, pour  . Ces opérations s’effectuent dans l’idéal après les saisons les plus humides.   Le bois est apprécié pour son aspect authentique et chaleureux, ce matériau est devenu l’un des revêtements de terrasse les plus répandus. Pendant ses années d’utilisation, le bois peut bouger du fait de la variation des températures et des intempéries. Sous l’effet de la chaleur et de l’humidité en particulier, des défauts apparaissent. Issu d’arbres (dans une démarche durable, privilégiez les origines écoresponsables), le bois est un matériau vivant. Au cours du temps il bouge et peut se dilater. Anticipez cette évolution du bois au moment de la pose de votre terrasse : laissez volontairement un petit espace entre chacune de vos lames en bois. Pensez aussi à protéger vos lambourdes avec un géotextile. Autre point important, l’entretien de votre terrasse en bois, dont le procédé peut varier d’une essence de bois à l’autre. Chacune des essences de bois possède ses propriétés spécifiques et elles ont donc des besoins différents pour offrir le meilleur d’elles-mêmes. La principale différence réside dans leur résistance à l’humidité.   Deux cas de figure sont possibles : Tout d’abord munissez-vous d’un grattoir. Il s’agit de   La surface doit être nette, débarrassée de toute saleté,  avant d’y passer un quelconque produit. Au-delà de l’opération de grattage,  . Selon son état, vous devrez le frotter avec un balai brosse et un jet d’eau. Puis, une fois cette étape terminée et votre terrasse en bois séchée à l’air libre, vous pourrez Nous vous conseillons d’utiliser un  . Ce produit est non filmogène. De ce fait, il est de loin le plus facile à entretenir dans le temps. En effet, il ne nécessite ni ponçage, ni décapage avant d’appliquer une couche d’entretien. Le  réchauffe l’aspect du bois et renforce l’impression de sécurité et de convivialité qui en émane. Avant toute utilisation sur l’ensemble de votre terrasse en bois, il est conseillé de   pour s’assurer du rendu final. Quelques conditions relatives à la pose du saturateur doivent être respectées : il faut l’appliquer lorsque la température extérieure est comprise entre 12° et 25° et sans vent . Le   pour l’application du saturateur. Lors du premier passage du pinceau plat, il faut   le bois. Après 15 min de séchage, votre bois est prêt à recevoir la deuxième couche du saturateur. Ensuite, vous essuierez l’excédent avec un chiffon non-pelucheux. Il faut jeter ce chiffon dans un sac fermé et hermétique. Enfin, la dernière étape est la plus reposante : . Il faut compter entre 24 h et 48 h pour un séchage complet. Dans tous les cas, bannissez l’utilisation des produits agressifs pour votre terrasse en bois naturel : eau de javel, white spirit etc.    au cours de son utilisation. Naturellement imputrescible, ce bois se passe de produit d’entretien comme le dégriseur, l’huile de protection ou la lasure. Hormis   le bois composite vous demandera très peu d’effort. Aidez-vous d’un   et d’eau chaude pour nettoyer votre sol extérieur et pour gagner du temps, nous vous conseillons même l’utilisation d’ . Attention, votre   et dans le sens de la lame. Cet entretien tout en rapidité et simplicité,  ravivera les couleurs et conservera la solidité de vos lames en bois composite. Naturel, résistant, imputrescible, le bois exotique cumule les qualités pour une utilisation en extérieur. D’une belle densité, très dur, il peut être remis à neuf à tout moment à l’aide d’un simple ponçage de votre terrasse en bois. D’un entretien facile, Le soin des lames exotique débute dès leur installation puis sur des périodes régulières, aux premiers signes de dégradations des lames.  . Dans le cas du bois exotique, vous devrez   à l’aide de papier à poncer. Cette étape permettra par la suite au saturateur de bien pénétrer dans le bois. Vous pouvez maintenant   Suivant le besoin, passez une à deux fois du saturateur sur le bois exotique. A chaque passage, vous veillerez à bien enlever les éventuels résidus. Suivez attentivement les consignes d’application du saturateur et dans tous les cas, testez-le auparavant. Vous obtiendrez un meilleur résultat après un dernier ponçage. Le temps passant, et du fait de leur exposition aux conditions climatiques,   Ainsi, votre terrasse en bois exotique retrouvera son éclat d’origine. Un dégriseur s’applique selon la même méthode qu’un saturateur."
Les astuces à connaître pour dégivrer son pare-brise,Conseils & Astuces,Les méthodes efficaces pour dégivrer son pare-brise | Les erreurs à éviter quand on dégivre son pare-brise | Prévenir l’apparition du gel,"Les basses températures reviennent en force avec leur lot de désagréments, dont la neige et le gel. Et malheureusement, ce dernier est souvent synonyme de  Corvée matinale ou bonheur hivernal, cela reste tout de même rarement une partie de plaisir. C’est un moment qui reste pour beaucoup un défi quotidien chronophage. Car oui, quoi de pire que de devoir gratter son pare-brise à l’aide sa carte vitale alors que l’on est en retard pour déposer ses enfants à l’école ? Chacun·e a ses astuces pour faire partir le givre rapidement et efficacement, mais parmi ces pratiques se cachent des erreurs qui pourraient endommager votre véhicule. Ne négligez pas votre auto et surtout, ne gâcher pas les efforts fournis  . Afin de  en toute sécurité et facilement, nous avons rassemblé nos meilleurs conseils. Cet hiver, prenez soin de votre voiture comme il se le doit et empruntez sereinement les routes enneigées avec une visibilité optimale. Des méthodes efficaces pour le dégivrer, à la prévention de la formation de la glace, en passant par les erreurs courantes à éviter ou encore les alternatives écologiques, dégivrer votre pare-brise deviendra bientôt un jeu d’enfant ! Nous vous livrons nos conseils les plus précieux afin de retrouver une visibilité impeccable. Testées et approuvées, ces méthodes sauront gagner votre cœur et feront très vite partie de vos habitudes ! La méthode n°1 en matière de   reste l’utilisation d’un  , aussi appelé raclette. Rose, bleu, à paillettes, … Il y en a pour tous les goûts ! Faciles à ranger, ils se glissent aussi bien dans le rangement d’une portière que dans la boîte à gants. Pour utiliser un grattoir, rien de plus simple ! Grattez le givre à l’aide de votre outil en parcourant la vitre avec des gestes horizontaux ou verticaux. Sachez qu’aujourd’hui il existe même des raclettes intégrées à l’intérieur d’un gant, de quoi rester au chaud ! Certain·es vous conseilleront d’allumer votre moteur et d’enclencher le chauffage en direction des vitres afin de faciliter votre tâche. Toutefois, cette solution reste inefficace puisqu’il faut généralement rouler durant plusieurs kilomètres avant que votre habitacle ne se réchauffe. Vous êtes en retard à votre réunion et vous vous retrouvez à devoir   sous un froid de canard ? Voici un accessoire qui devrait vous permettre de gagner du temps et de regagner l’habitacle au plus vite. En effet, Kärcher propose   qui permet de retirer le givre de toutes les surfaces vitrées de votre véhicule. Son   : il suffit de mettre le dégivreur en fonction, de retirer son cache de protection et ensuite d’exercer une pression sur la partie supérieure avec votre main. Ainsi, vous enlevez le gel de votre voiture en toute facilité. Pour des résultats rapides et efficaces, n’hésitez pas à vous tourner vers un dégivrant liquide. C’est en effet LE produit incontournable en matière de dégivrage. Il agit très rapidement et  . Son utilisation est également intuitive : pulvérisez-le à environ 20cm de votre pare-brise, puis retirez le givre à l’aide d’un chiffon propre ou d’une raclette.  peut avoir l’air simple, mais il existe toutefois un panel d’erreurs à ne pas commettre, sous peine de dégrader votre auto. Et personne n’a envie de se retrouver avec un pare-brise fissuré alors que les températures extérieures sont négatives… Voici donc une compilation des maladresses à éviter pour garder son auto en bonne santé. C’est bien connu, la chaleur fait fondre la glace. On observe d’ailleurs ce phénomène lorsque notre véhicule est garé face au soleil en hiver ; les traces de givres sont presque inexistantes. Toutefois, il est fortement déconseillé de verser de l’eau chaude, pire, bouillante, sur son pare-brise ! En effet, cela crée un choc thermique qui risquerait de  . De plus, l’eau chaude pourrait endommager votre carrosserie en enlevant la cire protectrice qui se trouve sur la peinture. Il est 7h30, vous devez partir dans les plus brefs délais, sous peine de vous retrouver dans les embouteillages. Mais voilà qu’il vous faut dégivrer votre pare-brise et pour couronner le tout, vous n’arrivez pas à remettre la main sur votre précieux grattoir ! Dans ce cas-là, évitez à tout prix d’utiliser des objets tranchants et/ou en métal. Ces derniers n’auront pour effet que de   et même d’aggraver certaines fissures existantes. Nombreuses sont les astuces qui vous garantissent de prévenir . Néanmoins, il existe parmi ces suggestions des choses à ne surtout pas faire. Et utiliser du carton ou du papier journal en fait partie. Il est parfois préconisé d’étaler un morceau de carton ou de journal sur votre pare-brise lorsque vous garez votre auto en fin de journée. Cette action a pour but d’éviter que le gel adhère sur la vitre.  Toutefois, ces deux matériaux ont tendance à rester  Afin d’éviter de commencer sa journée par un dégivrage intensif de son pare-brise, il y a tout de même des solutions pour anticiper la formation de la glace. Loin d’être d’une astuce de grand-mère, l’utilisation  reste à ce jour  . Facile à trouver sur le marché, elle s’installe également avec beaucoup d’aisance. Vous n’avez qu’à la déplier sur votre pare-brise ainsi qu’à recouvrir vos rétroviseurs extérieurs à l’aide des housses généralement attachées à elle. Afin de garantir leur tenue, certains modèles disposent même d’aimants qui s’accrochent autour du pare-brise. Cette housse peut également être utile lors de chutes de neige ; elle vous permettra de gagner quelques minutes avant de partir. De manière générale, il est important de préserver autant que faire se peut la planète. Chaque petit geste compte et a un réel impact. C’est ce pourquoi nous vous proposons une alternative écologique au spray dégivrant. En plus de ne pas être polluante, elle est  ! Elle se réalise à la maison à l’aide de deux ingrédients seulement. Dans un pulvérisateur propre, . Il suffit ensuite d’asperger le pare-brise, la lunette arrière et les vitres de votre voiture. Pour plus d’efficacité, il est conseillé de réaliser cela au moins une fois par mois. Cette solution permet de ne pas devoir se battre avec le givre tous les matins ! Vous avez désormais toutes les clés en main pour pouvoir dégivrer votre pare-brise efficacement. Parmi les accessoires qui permettent de  , vous trouverez le grattoir, le dégivreur de vitres ainsi que le dégivrant en spray. Quant aux erreurs à éviter, l’eau chaude, les objets tranchants ou encore l’utilisation de carton pour recouvrir votre pare-brise sont proscrits. Enfin, si vous souhaitez , optez pour une housse de protection, un stationnement à l’abri ou encore la pulvérisation d’une solution à base de vinaigre blanc et d’eau. Cet hiver, vous n’aurez plus d’excuse pour arriver en retard ! Ces articles pourraient aussi vous intéresser :"
Comment hiverner sa piscine ? Notre guide complet,Conseils & Astuces,Quel est le meilleur hivernage pour une piscine ? | Quels préparatifs avant d'hiverner sa piscine ? | Comment faire un hivernage passif ? | Comment faire un hivernage actif ? | Quels produits utiliser pour hiverner sa piscine ? | Quelle bâche pour l'hivernage d'une piscine ? | En résumé,"Tubulaires, en bois, rondes… Trouvez la piscine hors-sol de vos rêves à L’Entrepôt du Bricolage ! Chlore, traitement du pH, floculant, produit d’hivernage… Nous avons tout ce qu’il vous faut pour le traitement de votre piscine ! Pour rappel, l’hivernage actif est proscrit pour les régions où il y a du gel l’hiver."
Quelle quantité de ragréage pour rattraper un sol ?,Conseils & Astuces,Qu’est-ce que le ragréage d’un sol et pourquoi en faire ?  | Quand faut-il appliquer un ragréage ?  | Quels sont les types de ragréage et lequel choisir ?  | Peut-on faire un ragréage sur tous les supports ?  | Comment calculer le nombre de sacs nécessaires ? ,"Que soit pour l’intérieur ou l’extérieur, fibré ou autolissant, nous vous proposons une gamme complété de ragréage pour tous vos projets de rénovation ou d’aménagement"
